{
  "$schema": "../../schema/traca.geometry.schema.v0.3.json",
  "meta": {
    "format": "TRACA_general_geometry",
    "version": "0.3.0",
    "case_id": "A2_RECEPTION_FEINT_2X1",
    "source_revision": "fnv1a:7509ce20",
    "status": "resolved",
    "authority": "provisional_visual_policy",
    "composition_fingerprint": "fnv1a:82a3f4c4",
    "canonical_promotion": false,
    "court_profile_ref": "IHF_INDOOR_HANDBALL_COURT_2025@1.0.0"
  },
  "court": {
    "width_m": 20,
    "half_length_m": 20,
    "goal": {
      "width_m": 3,
      "height_m": 2,
      "post_width_m": 0.08
    },
    "markings": {
      "goal_area_radius_m": 6,
      "goal_area_straight_m": 3,
      "free_throw_distance_m": 9,
      "free_throw_segment_m": 0.15,
      "free_throw_gap_m": 0.15,
      "penalty_line_distance_m": 7,
      "penalty_line_length_m": 1,
      "goalkeeper_line_distance_m": 4,
      "goalkeeper_line_length_m": 0.15,
      "throw_off_diameter_m": 4
    },
    "view_box": [
      -0.8,
      -1,
      21.6,
      21.8
    ]
  },
  "layout_policy": {
    "id": "generic_relational_layout_v0.3",
    "version": "0.3.0",
    "status": "provisional_render_policy",
    "coordinate_system": "metres_origin_goal_line_left",
    "attack_direction": "negative_y",
    "notes": [
      "Distribució derivada de delimitadors, espais, dependències d’acció i relacions numèriques.",
      "Les distàncies són una política visual versionada i no coneixement tàctic."
    ],
    "decisions": [
      {
        "id": "LAYOUT_0001",
        "type": "relational_delimiter_order",
        "target_ref": "STATE_D1_S0",
        "status": "provisional_visual_policy",
        "position": [
          6,
          7.2
        ],
        "source_refs": [
          "relation:delimiter:D1",
          "coach_input:span:68-71",
          "space:INT_12",
          "canonical:interval:INT_12",
          "docs/DOMAIN_MODEL.md#3-espais-i-intervals"
        ]
      },
      {
        "id": "LAYOUT_0002",
        "type": "relational_delimiter_order",
        "target_ref": "STATE_D2_S0",
        "status": "provisional_visual_policy",
        "position": [
          10,
          7.2
        ],
        "source_refs": [
          "relation:delimiter:D2",
          "coach_input:span:93-95",
          "coach_input:span:68-71",
          "space:INT_12",
          "canonical:interval:INT_12",
          "docs/DOMAIN_MODEL.md#3-espais-i-intervals",
          "coach_input:span:120-123",
          "space:INT_23",
          "canonical:interval:INT_23"
        ]
      },
      {
        "id": "LAYOUT_0003",
        "type": "relational_delimiter_order",
        "target_ref": "STATE_D3_S0",
        "status": "provisional_visual_policy",
        "position": [
          14,
          7.2
        ],
        "source_refs": [
          "relation:delimiter:D3",
          "coach_input:span:165-167",
          "coach_input:span:120-123",
          "space:INT_23",
          "canonical:interval:INT_23",
          "docs/DOMAIN_MODEL.md#3-espais-i-intervals",
          "coach_input:span:158-167"
        ]
      },
      {
        "id": "LAYOUT_0004",
        "type": "space_exit_after_defensive_line",
        "target_ref": "STATE_L_A003_EXIT",
        "status": "provisional_visual_policy",
        "position": [
          12,
          5.5
        ],
        "source_refs": [
          "space:INT_23",
          "coach_input:span:73-85",
          "coach_input:span:120-123"
        ]
      },
      {
        "id": "LAYOUT_0005",
        "type": "space_approach_anchor",
        "target_ref": "STATE_L_RECEPTION_A002",
        "status": "provisional_visual_policy",
        "position": [
          8,
          10
        ],
        "source_refs": [
          "space:INT_12",
          "coach_input:span:3-27",
          "coach_input:span:32-43",
          "coach_input:span:68-71"
        ]
      },
      {
        "id": "LAYOUT_0006",
        "type": "pass_sender_from_receiver",
        "target_ref": "STATE_CE_S0",
        "status": "provisional_visual_policy",
        "position": [
          11,
          13
        ],
        "source_refs": [
          "action:A001",
          "coach_input:span:3-10"
        ]
      },
      {
        "id": "LAYOUT_0007",
        "type": "reception_approach",
        "target_ref": "STATE_L_S0",
        "status": "provisional_visual_policy",
        "position": [
          5.6,
          13
        ],
        "source_refs": [
          "action:A002",
          "coach_input:span:20-27",
          "coach_input:span:3-27"
        ]
      },
      {
        "id": "LAYOUT_0008",
        "type": "numerical_relation_participant",
        "target_ref": "STATE_PV_S0",
        "status": "provisional_visual_policy",
        "position": [
          15.25,
          6.4
        ],
        "source_refs": [
          "action:A004",
          "coach_input:span:152-157",
          "coach_input:span:145-157"
        ]
      }
    ]
  },
  "zones": [],
  "spaces": [
    {
      "id": "INT_12",
      "kind": "relational_tactical_space",
      "relation": {
        "type": "between",
        "delimiter_refs": [
          "D1",
          "D2"
        ]
      },
      "anchor": [
        8,
        7.2
      ],
      "calculation_region": [
        [
          7.55,
          6.75
        ],
        [
          8.45,
          6.75
        ],
        [
          8.45,
          7.65
        ],
        [
          7.55,
          7.65
        ]
      ],
      "render_policy": "hidden",
      "source_refs": [
        "coach_input:span:68-71",
        "canonical:interval:INT_12",
        "docs/DOMAIN_MODEL.md#3-espais-i-intervals"
      ]
    },
    {
      "id": "INT_23",
      "kind": "relational_tactical_space",
      "relation": {
        "type": "between",
        "delimiter_refs": [
          "D2",
          "D3"
        ]
      },
      "anchor": [
        12,
        7.2
      ],
      "calculation_region": [
        [
          11.55,
          6.75
        ],
        [
          12.45,
          6.75
        ],
        [
          12.45,
          7.65
        ],
        [
          11.55,
          7.65
        ]
      ],
      "render_policy": "hidden",
      "source_refs": [
        "coach_input:span:120-123",
        "canonical:interval:INT_23",
        "docs/DOMAIN_MODEL.md#3-espais-i-intervals"
      ]
    }
  ],
  "objects": [],
  "phases": [],
  "entities": [
    {
      "id": "CE",
      "kind": "attacker",
      "label": "CE",
      "position": [
        11,
        13
      ],
      "state_ref": "STATE_CE_S0",
      "status": "derived",
      "presence": "explicit",
      "source_refs": [
        "coach_input:span:3-10"
      ]
    },
    {
      "id": "D2",
      "kind": "defender",
      "label": "D2",
      "position": [
        10,
        7.2
      ],
      "state_ref": "STATE_D2_S0",
      "status": "derived",
      "presence": "explicit",
      "source_refs": [
        "coach_input:span:93-95",
        "coach_input:span:68-71",
        "space:INT_12",
        "canonical:interval:INT_12",
        "docs/DOMAIN_MODEL.md#3-espais-i-intervals",
        "coach_input:span:120-123",
        "space:INT_23",
        "canonical:interval:INT_23"
      ]
    },
    {
      "id": "D3",
      "kind": "defender",
      "label": "D3",
      "position": [
        14,
        7.2
      ],
      "state_ref": "STATE_D3_S0",
      "status": "derived",
      "presence": "explicit",
      "source_refs": [
        "coach_input:span:165-167",
        "coach_input:span:120-123",
        "space:INT_23",
        "canonical:interval:INT_23",
        "docs/DOMAIN_MODEL.md#3-espais-i-intervals",
        "coach_input:span:158-167"
      ]
    },
    {
      "id": "L",
      "kind": "attacker",
      "label": "L",
      "position": [
        5.6,
        13
      ],
      "state_ref": "STATE_L_S0",
      "status": "derived",
      "presence": "explicit",
      "source_refs": [
        "coach_input:span:20-27",
        "coach_input:span:3-27"
      ]
    },
    {
      "id": "PV",
      "kind": "pivot",
      "label": "PV",
      "position": [
        15.25,
        6.4
      ],
      "state_ref": "STATE_PV_S0",
      "status": "derived",
      "presence": "explicit",
      "source_refs": [
        "coach_input:span:152-157",
        "coach_input:span:145-157"
      ]
    }
  ],
  "participant_states": [
    {
      "id": "STATE_CE_S0",
      "participant_ref": "CE",
      "state_key": "S0",
      "phase_ref": null,
      "space_ref": null,
      "functional_position_ref": null,
      "position": [
        11,
        13
      ],
      "status": "current",
      "authority": "coach_explicit_input",
      "source_refs": [
        "coach_input:span:3-10"
      ],
      "layout_decision_ref": "LAYOUT_0006",
      "visibility": "normal"
    },
    {
      "id": "STATE_D1_S0",
      "participant_ref": "D1",
      "state_key": "S0",
      "phase_ref": null,
      "space_ref": null,
      "functional_position_ref": null,
      "position": [
        6,
        7.2
      ],
      "status": "current",
      "authority": "derived_from_validated_rule",
      "source_refs": [
        "coach_input:span:68-71",
        "space:INT_12",
        "canonical:interval:INT_12",
        "docs/DOMAIN_MODEL.md#3-espais-i-intervals"
      ],
      "layout_decision_ref": "LAYOUT_0001",
      "visibility": "control"
    },
    {
      "id": "STATE_D2_S0",
      "participant_ref": "D2",
      "state_key": "S0",
      "phase_ref": null,
      "space_ref": null,
      "functional_position_ref": null,
      "position": [
        10,
        7.2
      ],
      "status": "current",
      "authority": "coach_explicit_input",
      "source_refs": [
        "coach_input:span:93-95",
        "coach_input:span:68-71",
        "space:INT_12",
        "canonical:interval:INT_12",
        "docs/DOMAIN_MODEL.md#3-espais-i-intervals",
        "coach_input:span:120-123",
        "space:INT_23",
        "canonical:interval:INT_23"
      ],